{
  "schemaVersion": 2,
  "metadata": { "changeId": "20260830-order-management-tabs-detail", "pageName": "订单详情", "pageType": "order-detail", "componentLibrary": { "name": "antd", "source": "official" }, "request": "订单详情页：展示订单号、客户名称、订单金额、支付方式、支付状态、下单时间和收货信息，支持返回原 Tab 和原查询条件", "assumptions": ["未提供后端接口，详情使用浏览器内演示数据；通过 URL 的 id 参数定位订单，return 参数保存原列表上下文。"], "ruleRefs": ["DESIGN.md", "01-foundations.md", "02-components.md", "06-detail-patterns.md", "execution/presentation-intent.md", "execution/page-contract-v2.md", "execution/capability-model/capability-model.md"], "generation": { "mode": "auto", "strategy": "standard", "recipeId": "detail.grouped", "skeleton": "detail-workbench", "capabilities": ["detail.groups", "detail.metrics", "navigation.openPage"], "policyVersion": 1, "modelVersion": "2026.08.30.3", "rendererId": "yipex-standard-grouped-detail-v1" } },
  "contract": { "pageFamily": "detail", "shell": "yipex-default", "density": "standard", "regions": [{ "id": "order-detail", "role": "detail", "purpose": "核对订单基础、支付和收货信息" }, { "id": "order-detail-actions", "role": "action", "purpose": "返回原订单列表上下文" }], "hierarchy": { "primary": "快速核对订单详情", "secondary": ["确认订单支付状态和收货信息"] }, "operations": { "primary": { "id": "back-order-list", "label": "返回列表", "placement": "详情内容底部右侧", "outcome": "返回原 Tab、原查询条件和原分页" }, "secondary": [] }, "stateCoverage": ["loading", "error", "permission-denied"], "responsive": { "desktop": "详情按基础、支付和收货主题分组，字段默认三列展示。", "narrow": "字段降为单列并保留返回列表操作。" }, "deviations": [] },
  "page": {
    "shell": { "id": "yipex-default", "sidebar": { "width": 200, "background": "#F0F0F0", "showCollapseControl": true }, "brand": { "name": "Yipex", "logo": "logo.svg" }, "navigation": [{ "id": "home", "label": "首页", "icon": "HomeOutlined" }, { "id": "order-management", "label": "订单管理", "icon": "ProfileOutlined", "active": true }], "header": { "welcome": "订单详情", "userName": "订单运营", "email": "operations@yipex.tech", "avatar": "运" }, "footer": { "copyright": "Copyright Somei E-Commerce Limited 2025. All rights reserved" }, "floatingTools": { "show": false } },
    "root": { "id": "order-detail-page", "type": "standard-grouped-detail-page", "props": { "title": "订单详情", "footerActionLabel": "返回列表" }, "children": [{ "id": "order-detail", "type": "detail", "label": "订单详情" }, { "id": "order-detail-actions", "type": "action", "children": [{ "id": "back-order-list", "type": "button", "label": "返回列表", "events": { "click": "backOrderList" } }] }] },
    "data": { "demo": true, "recordIdParam": "id", "returnParam": "return", "persistenceKey": "yipex-order-management-tabs-demo", "entryHref": "../order-list/preview.html", "record": { "id": "ORD20260830001", "customerName": "林知夏", "amount": 1280, "status": "PENDING", "statusLabel": "待付款", "orderedAt": "2026-08-30 09:42", "paymentMethodLabel": "微信支付", "address": "上海市静安区愚园路 218 号", "items": "企业咖啡月度套餐" }, "records": [{ "id": "ORD20260830001", "customerName": "林知夏", "amount": 1280, "status": "PENDING", "statusLabel": "待付款", "orderedAt": "2026-08-30 09:42", "paymentMethodLabel": "微信支付", "address": "上海市静安区愚园路 218 号", "items": "企业咖啡月度套餐" }, { "id": "ORD20260829012", "customerName": "周远", "amount": 869.5, "status": "PAID", "statusLabel": "已付款", "orderedAt": "2026-08-29 16:20", "paymentMethodLabel": "支付宝", "address": "杭州市西湖区文三路 88 号", "items": "家居收纳组合" }, { "id": "ORD20260828008", "customerName": "赵晴", "amount": 326, "status": "COMPLETED", "statusLabel": "已完成", "orderedAt": "2026-08-28 11:06", "paymentMethodLabel": "银行卡", "address": "宁波市鄞州区中山东路 520 号", "items": "商务午餐套餐" }, { "id": "ORD20260827017", "customerName": "吴川", "amount": 2450, "status": "PENDING", "statusLabel": "待付款", "orderedAt": "2026-08-27 09:15", "paymentMethodLabel": "支付宝", "address": "成都市锦江区春熙路 66 号", "items": "轻量徒步帐篷" }, { "id": "ORD20260826005", "customerName": "沈念", "amount": 158.8, "status": "CANCELLED", "statusLabel": "已取消", "orderedAt": "2026-08-26 14:32", "paymentMethodLabel": "微信支付", "address": "北京市东城区朝阳门内大街 101 号", "items": "人文社科图书" }, { "id": "ORD20260825019", "customerName": "梁峰", "amount": 3600, "status": "PAID", "statusLabel": "已付款", "orderedAt": "2026-08-25 10:52", "paymentMethodLabel": "银行卡", "address": "深圳市南山区深南大道 9001 号", "items": "年度运动课程" }, { "id": "ORD20260824011", "customerName": "钱悦", "amount": 498, "status": "CANCELLED", "statusLabel": "已取消", "orderedAt": "2026-08-24 12:08", "paymentMethodLabel": "微信支付", "address": "苏州市姑苏区十全街 39 号", "items": "节日烘焙礼盒" }], "sections": [{ "id": "basic", "title": "订单信息", "fields": [{ "key": "id", "label": "订单号" }, { "key": "customerName", "label": "客户名称" }, { "key": "amount", "label": "订单金额 (元)", "format": "currency" }] }, { "id": "payment", "title": "支付信息", "fields": [{ "key": "status", "label": "支付状态", "format": "status", "labelKey": "statusLabel" }, { "key": "paymentMethodLabel", "label": "支付方式" }, { "key": "orderedAt", "label": "下单时间" }] }, { "id": "delivery", "title": "收货信息", "fields": [{ "key": "address", "label": "收货地址", "span": "full" }, { "key": "items", "label": "商品摘要", "span": "full" }] }], "metrics": [], "relatedTables": [] },
    "states": { "loading": false, "error": false, "permission-denied": false }, "interactions": [{ "id": "backOrderList", "source": "back-order-list", "event": "click", "outcome": "返回原 Tab、原查询条件和原分页" }], "extensions": { "presentationDecisions": { "order-detail": { "mode": "detail-page", "confidence": "explicit", "evidence": ["需求明确要求查看详情后返回原 Tab 和原查询条件"], "baseComponent": "Descriptions", "requiresDeviation": false } }, "renderer": "yipex-standard-grouped-detail-v1", "generation": { "strategy": "standard", "recipeId": "detail.grouped", "skeleton": "detail-workbench", "capabilities": ["detail.groups", "detail.metrics", "navigation.openPage"], "rendererId": "yipex-standard-grouped-detail-v1" } }
  }
}
