{
  "schemaVersion": 2,
  "metadata": { "changeId": "20260830-order-management-tabs-create", "pageName": "新增订单", "pageType": "order-create-form", "componentLibrary": { "name": "antd", "source": "official" }, "request": "新增订单表单：填写客户名称、订单金额、支付方式和支付状态，保存后返回全部订单 Tab 并刷新列表", "assumptions": ["未提供后端接口，保存使用浏览器内演示数据；订单号和下单时间由浏览器生成。"], "ruleRefs": ["DESIGN.md", "01-foundations.md", "02-components.md", "05-form-patterns.md", "execution/presentation-intent.md", "execution/page-contract-v2.md", "execution/capability-model/capability-model.md"], "generation": { "mode": "auto", "strategy": "standard", "recipeId": "form.grouped-submit", "skeleton": "form-workflow", "capabilities": ["form.groups", "form.validation", "form.stickyActions", "action.primary", "action.secondary", "binding.submissionToResult"], "policyVersion": 1, "modelVersion": "2026.08.30.3", "rendererId": "yipex-standard-grouped-form-v1" } },
  "contract": { "pageFamily": "form", "shell": "yipex-default", "density": "standard", "regions": [{ "id": "order-form", "role": "form", "purpose": "填写新增订单信息" }, { "id": "order-form-actions", "role": "action", "purpose": "取消或保存订单" }], "hierarchy": { "primary": "完成订单信息填写并保存", "secondary": ["校验客户、金额和支付信息"] }, "operations": { "primary": { "id": "save-order", "label": "保存", "placement": "表单底部右侧", "outcome": "校验并保存订单，返回全部订单 Tab 并刷新" }, "secondary": [{ "id": "cancel-order-create", "label": "取消", "placement": "保存按钮左侧", "outcome": "放弃填写并返回全部订单 Tab" }] }, "stateCoverage": ["loading", "submitting", "error", "success", "permission-denied"], "responsive": { "desktop": "订单字段按主题分组并使用三列网格，底部操作区右对齐。", "narrow": "字段改为单列，底部操作区保持可见。" }, "deviations": [] },
  "page": {
    "shell": { "id": "yipex-default", "sidebar": { "width": 200, "background": "#F0F0F0", "showCollapseControl": true }, "brand": { "name": "Yipex", "logo": "logo.svg" }, "navigation": [{ "id": "home", "label": "首页", "icon": "HomeOutlined" }, { "id": "order-management", "label": "订单管理", "icon": "ProfileOutlined", "active": true }], "header": { "welcome": "新增订单", "userName": "订单运营", "email": "operations@yipex.tech", "avatar": "运" }, "footer": { "copyright": "Copyright Somei E-Commerce Limited 2025. All rights reserved" }, "floatingTools": { "show": false } },
    "root": { "id": "order-create-page", "type": "standard-grouped-form-page", "props": { "title": "新增订单", "primaryActionLabel": "保存", "secondaryActionLabel": "取消" }, "children": [{ "id": "order-form", "type": "form", "label": "订单信息", "children": [{ "id": "order-basic-section", "type": "form-section", "label": "基础信息" }, { "id": "order-payment-section", "type": "form-section", "label": "支付信息" }, { "id": "order-delivery-section", "type": "form-section", "label": "收货信息" }] }, { "id": "order-form-actions", "type": "action", "children": [{ "id": "cancel-order-create", "type": "button", "label": "取消", "events": { "click": "cancelOrderCreate" } }, { "id": "save-order", "type": "button", "label": "保存", "events": { "click": "saveOrder" } }] }] },
    "data": { "demo": true, "mode": "create", "persistenceKey": "yipex-order-management-tabs-demo", "entryHref": "../order-list/preview.html", "sections": [{ "id": "basic", "title": "基础信息", "fields": [{ "key": "customerName", "label": "客户名称", "required": true, "placeholder": "请输入客户名称" }, { "key": "amount", "label": "订单金额", "type": "amount", "required": true, "prefix": "¥", "min": 0.01, "precision": 2, "placeholder": "请输入订单金额" }] }, { "id": "payment", "title": "支付信息", "fields": [{ "key": "paymentMethod", "label": "支付方式", "type": "select", "required": true, "labelKey": "paymentMethodLabel", "options": [{ "value": "WECHAT", "label": "微信支付" }, { "value": "ALIPAY", "label": "支付宝" }, { "value": "CARD", "label": "银行卡" }] }, { "key": "status", "label": "支付状态", "type": "select", "required": true, "labelKey": "statusLabel", "options": [{ "value": "PENDING", "label": "待付款" }, { "value": "PAID", "label": "已付款" }, { "value": "COMPLETED", "label": "已完成" }, { "value": "CANCELLED", "label": "已取消" }] }] }, { "id": "delivery", "title": "收货信息", "fields": [{ "key": "address", "label": "收货地址", "required": true, "span": "full", "placeholder": "请输入收货地址" }, { "key": "items", "label": "商品摘要", "required": true, "span": "full", "placeholder": "请输入商品或服务名称" }] }], "initialValues": { "status": "PENDING", "paymentMethod": "WECHAT" }, "create": { "idPrefix": "ORD", "idField": "id", "timestampField": "orderedAt" }, "demoSubmission": { "mode": "success", "latencyMs": 450, "successMessage": "订单新增成功", "returnHref": "../order-list/preview.html" } },
    "states": { "loading": false, "submitting": false, "error": false, "success": false, "permission-denied": false }, "interactions": [{ "id": "cancelOrderCreate", "source": "cancel-order-create", "event": "click", "outcome": "返回全部订单 Tab 且不保存" }, { "id": "saveOrder", "source": "save-order", "event": "click", "outcome": "校验并保存订单并返回全部订单 Tab" }], "extensions": { "presentationDecisions": {}, "renderer": "yipex-standard-grouped-form-v1", "generation": { "strategy": "standard", "recipeId": "form.grouped-submit", "skeleton": "form-workflow", "capabilities": ["form.groups", "form.validation", "form.stickyActions", "action.primary", "action.secondary", "binding.submissionToResult"], "rendererId": "yipex-standard-grouped-form-v1" } }
  }
}
