{
  "schemaVersion": 2,
  "metadata": {
    "changeId": "20260830-customer-management-create",
    "pageName": "新增客户",
    "pageType": "customer-create-form",
    "componentLibrary": {
      "name": "antd",
      "source": "official"
    },
    "request": "/yipex:page 生成客户管理流程，包含客户列表和新增客户两个关联页面。客户列表支持关键词、客户类型和状态筛选，表格顶部提供“新增客户”按钮；点击后进入新增客户页面。新增页面包含基础信息、联系人和结算信息，提交成功后返回客户列表，并用 message 提示成功，按创建时间倒序展示新客户；取消时直接返回且不保存",
    "assumptions": [
      "基础信息包含客户编号、客户名称、客户类型；联系人包含姓名、手机号、邮箱；结算信息包含结算周期、结算币种和结算账户。",
      "未提供后端接口，提交和返回使用浏览器本地演示数据。",
      "客户编号由录入人员填写，并作为列表记录的唯一标识。"
    ],
    "ruleRefs": [
      "DESIGN.md",
      "01-foundations.md",
      "02-components.md",
      "05-form-patterns.md",
      "execution/presentation-intent.md",
      "execution/page-contract-v2.md",
      "execution/capability-model/capability-model.md"
    ],
    "generation": {
      "mode": "auto",
      "strategy": "standard",
      "recipeId": "form.grouped-submit",
      "skeleton": "form-workflow",
      "capabilities": [
        "form.groups",
        "form.validation",
        "form.stickyActions",
        "action.primary",
        "action.secondary"
      ],
      "policyVersion": 1,
      "modelVersion": "2026.08.30.1",
      "rendererId": "yipex-standard-grouped-form-v1"
    }
  },
  "contract": {
    "pageFamily": "form",
    "shell": "yipex-default",
    "density": "compact",
    "regions": [
      {
        "id": "customer-form",
        "role": "form",
        "purpose": "按基础信息、联系人和结算信息分组录入客户"
      },
      {
        "id": "customer-form-actions",
        "role": "action",
        "purpose": "提交客户或取消返回列表"
      }
    ],
    "hierarchy": {
      "primary": "完成客户资料录入并提交",
      "secondary": [
        "按信息分组核对字段",
        "取消时不保存并返回客户列表"
      ]
    },
    "operations": {
      "primary": {
        "id": "save-customer",
        "label": "提交",
        "placement": "固定吸底栏最右侧",
        "outcome": "校验并保存客户，返回列表后置顶新客户并提示成功"
      },
      "secondary": [
        {
          "id": "cancel-customer",
          "label": "取消",
          "placement": "提交按钮左侧",
          "outcome": "不保存当前内容并返回客户列表"
        }
      ]
    },
    "stateCoverage": [
      "loading",
      "submitting",
      "error",
      "success",
      "permission-denied"
    ],
    "responsive": {
      "desktop": "三个业务模块使用三列字段网格，固定吸底操作栏右对齐。",
      "narrow": "字段改为单列，模块保持清晰分组，操作栏覆盖全宽。"
    },
    "deviations": []
  },
  "page": {
    "shell": {
      "id": "yipex-default",
      "sidebar": {
        "width": 200,
        "background": "#F0F0F0",
        "showCollapseControl": true
      },
      "brand": {
        "name": "Yipex",
        "logo": "logo.svg"
      },
      "navigation": [
        {
          "id": "home",
          "label": "首页",
          "icon": "HomeOutlined"
        },
        {
          "id": "customer-management",
          "label": "客户管理",
          "icon": "TeamOutlined",
          "active": true
        }
      ],
      "header": {
        "welcome": "客户管理",
        "userName": "平台运营",
        "email": "operations@yipex.tech",
        "avatar": "运"
      },
      "footer": {
        "copyright": "Copyright Somei E-Commerce Limited 2025. All rights reserved"
      },
      "floatingTools": {
        "show": false
      }
    },
    "root": {
      "id": "customer-create-page",
      "type": "standard-grouped-form-page",
      "props": {
        "primaryActionLabel": "提交",
        "secondaryActionLabel": "取消"
      },
      "children": [
        {
          "id": "customer-form",
          "type": "form",
          "label": "新增客户表单",
          "children": [
            {
              "id": "customer-basic-section",
              "type": "form-section",
              "label": "基础信息"
            },
            {
              "id": "customer-contact-section",
              "type": "form-section",
              "label": "联系人"
            },
            {
              "id": "customer-settlement-section",
              "type": "form-section",
              "label": "结算信息"
            }
          ]
        },
        {
          "id": "customer-form-actions",
          "type": "action",
          "children": [
            {
              "id": "cancel-customer",
              "type": "button",
              "label": "取消",
              "events": {
                "click": "cancelCustomer"
              }
            },
            {
              "id": "save-customer",
              "type": "button",
              "label": "提交",
              "events": {
                "click": "saveCustomer"
              }
            }
          ]
        }
      ]
    },
    "data": {
      "demo": true,
      "persistenceKey": "yipex-customer-management-demo",
      "sections": [
        {
          "id": "basic",
          "title": "基础信息",
          "fields": [
            {
              "key": "customerId",
              "label": "客户编号",
              "required": true,
              "placeholder": "请输入客户编号，例如 C20260830021"
            },
            {
              "key": "customerName",
              "label": "客户名称",
              "required": true,
              "placeholder": "请输入企业或个人名称"
            },
            {
              "key": "customerType",
              "label": "客户类型",
              "type": "select",
              "required": true,
              "options": [
                {
                  "value": "MERCHANT",
                  "label": "企业客户"
                },
                {
                  "value": "INDIVIDUAL",
                  "label": "个人客户"
                }
              ]
            }
          ]
        },
        {
          "id": "contact",
          "title": "联系人",
          "fields": [
            {
              "key": "contactName",
              "label": "联系人姓名",
              "required": true,
              "placeholder": "请输入联系人姓名"
            },
            {
              "key": "contactPhone",
              "label": "联系电话",
              "type": "text",
              "required": true,
              "placeholder": "请输入手机号"
            },
            {
              "key": "contactEmail",
              "label": "联系邮箱",
              "type": "text",
              "required": true,
              "placeholder": "请输入邮箱地址"
            }
          ]
        },
        {
          "id": "settlement",
          "title": "结算信息",
          "fields": [
            {
              "key": "settlementCycle",
              "label": "结算周期",
              "type": "select",
              "required": true,
              "options": [
                {
                  "value": "T1",
                  "label": "T+1"
                },
                {
                  "value": "T7",
                  "label": "T+7"
                },
                {
                  "value": "MONTHLY",
                  "label": "月结"
                }
              ]
            },
            {
              "key": "settlementCycleLabel",
              "label": "结算方式名称",
              "required": true,
              "placeholder": "例如：月结"
            },
            {
              "key": "settlementCurrency",
              "label": "结算币种",
              "type": "select",
              "required": true,
              "options": [
                {
                  "value": "CNY",
                  "label": "CNY"
                },
                {
                  "value": "USD",
                  "label": "USD"
                },
                {
                  "value": "USDT",
                  "label": "USDT"
                }
              ]
            },
            {
              "key": "settlementAccount",
              "label": "结算账户",
              "required": true,
              "span": "full",
              "placeholder": "请输入银行卡号或钱包地址"
            }
          ]
        }
      ],
      "initialValues": {
        "customerType": "MERCHANT",
        "settlementCurrency": "CNY"
      },
      "demoSubmission": {
        "mode": "success",
        "latencyMs": 500,
        "successMessage": "客户新增成功",
        "returnHref": "../customer-list/preview.html"
      },
      "resetOnRefresh": true,
      "entryHref": "../customer-list/preview.html"
    },
    "states": {
      "loading": false,
      "submitting": false,
      "error": false,
      "success": false,
      "permission-denied": false
    },
    "interactions": [
      {
        "id": "saveCustomer",
        "trigger": "save-customer.click",
        "result": "校验并保存客户，显示成功 message 后返回列表"
      },
      {
        "id": "cancelCustomer",
        "trigger": "cancel-customer.click",
        "result": "不保存当前内容并直接返回列表"
      }
    ],
    "extensions": {
      "presentationDecisions": {
        "customer-form": {
          "mode": "grouped-form-sections",
          "confidence": "explicit",
          "evidence": [
            "新增页面明确包含基础信息、联系人和结算信息三个业务分组"
          ],
          "baseComponent": "Card + Form",
          "requiresDeviation": false
        }
      },
      "renderer": "yipex-standard-grouped-form-v1",
      "generation": {
        "strategy": "standard",
        "recipeId": "form.grouped-submit",
        "skeleton": "form-workflow",
        "capabilities": [
          "form.groups",
          "form.validation",
          "form.stickyActions",
          "action.primary",
          "action.secondary"
        ],
        "rendererId": "yipex-standard-grouped-form-v1"
      }
    }
  }
}
