{
  "schemaVersion": 2,
  "metadata": {
    "changeId": "20260830-activity-publish-management-create",
    "pageName": "新增活动",
    "pageType": "activity-stepped-form",
    "componentLibrary": { "name": "antd", "source": "official" },
    "request": "生成活动发布管理流程，包含活动列表和新增活动分步表单。",
    "assumptions": ["未提供后端接口，提交和草稿使用浏览器 localStorage 演示持久化。", "封面图片只保存本地文件名用于演示。"],
    "ruleRefs": ["execution/context-packs/core.md", "design-system/director-rules/01-visual-constitution.md", "design-system/director-rules/02-template-application-rules.md", "design-system/director-rules/03-interaction-acceptance-rules.md", "design-system/page-patterns/form.md", "execution/page-contract-v2.md", "execution/capability-model/capability-model.md"],
    "generation": { "mode": "standard", "strategy": "standard", "recipeId": "form.stepped-submit", "skeleton": "form-workflow", "capabilities": ["form.steps", "form.validation", "form.stickyActions", "form.review", "action.primary", "action.secondary", "binding.submissionToResult", "navigation.openPage"], "policyVersion": 2, "modelVersion": "2026.08.30.6", "rendererId": "yipex-standard-stepped-form-v1" }
  },
  "contract": {
    "pageFamily": "form", "shell": "yipex-default", "density": "standard",
    "regions": [{ "id": "activity-steps", "role": "form", "purpose": "按基本信息、报名设置和发布确认三步维护活动" }, { "id": "activity-step-actions", "role": "action", "purpose": "在步骤间导航、保存草稿、预览或发布活动" }],
    "hierarchy": { "primary": "完成活动信息填写并发布", "secondary": ["逐步校验当前步骤必填信息", "随时保存草稿并在确认步骤复核完整内容"] },
    "operations": {
      "primary": { "id": "publish-activity", "label": "发布", "placement": "发布确认步骤底部右侧", "outcome": "校验全部必填项、保存活动并返回活动列表" },
      "secondary": [{ "id": "next-activity-step", "label": "下一步", "placement": "非末步操作区右侧", "outcome": "校验当前步骤后进入下一步" }, { "id": "save-activity-draft", "label": "保存草稿", "placement": "步骤操作区", "outcome": "保存当前填写内容并停留当前步骤" }, { "id": "preview-activity-form", "label": "预览", "placement": "发布确认步骤操作区", "outcome": "打开活动预览弹窗" }, { "id": "previous-activity-step", "label": "上一步", "placement": "操作区左侧", "outcome": "返回上一步并保留已填写内容" }, { "id": "cancel-activity", "label": "取消", "placement": "首步操作区左侧", "outcome": "放弃本次未保存修改并返回活动列表" }]
    },
    "stateCoverage": ["loading", "submitting", "error", "success", "permission-denied"],
    "responsive": { "desktop": "步骤条横向展示，表单字段按两列组织，底部操作区右对齐并固定可见。", "narrow": "步骤条压缩为窄屏布局，字段改为单列，操作按钮保持可操作。" },
    "deviations": []
  },
  "page": {
    "shell": { "id": "yipex-default", "sidebar": { "width": 200, "background": "#F0F0F0", "showCollapseControl": true }, "brand": { "name": "Yipex", "logo": "logo.svg" }, "navigation": [{ "id": "home", "label": "首页", "icon": "HomeOutlined" }, { "id": "activity-management", "label": "活动管理", "icon": "CalendarOutlined", "active": true }], "header": { "welcome": "新增活动", "userName": "平台运营", "email": "operations@yipex.tech", "avatar": "活" }, "footer": { "copyright": "Copyright Somei E-Commerce Limited 2025. All rights reserved" }, "floatingTools": { "show": false } },
    "root": { "id": "activity-create-page", "type": "standard-stepped-form-page", "props": { "title": "新增活动", "primaryActionLabel": "发布", "secondaryActionLabel": "取消" }, "children": [{ "id": "activity-steps", "type": "steps-form", "label": "新增活动分步表单" }, { "id": "activity-step-actions", "type": "action", "children": [{ "id": "cancel-activity", "type": "button", "label": "取消", "events": { "click": "cancelActivity" } }, { "id": "previous-activity-step", "type": "button", "label": "上一步", "events": { "click": "previousActivityStep" } }, { "id": "save-activity-draft", "type": "button", "label": "保存草稿", "events": { "click": "saveActivityDraft" } }, { "id": "preview-activity-form", "type": "button", "label": "预览", "events": { "click": "previewActivityForm" } }, { "id": "next-activity-step", "type": "button", "label": "下一步", "events": { "click": "nextActivityStep" } }, { "id": "publish-activity", "type": "button", "label": "发布", "events": { "click": "publishActivity" } }] }] },
    "data": {
      "demo": true,
      "mode": "create",
      "recordIdParam": "id",
      "persistenceKey": "yipex-activity-publish-management-demo",
      "entryHref": "../activity-list/preview.html",
      "records": [{ "id": "ACT20260830018", "activityName": "跨境支付增长线上分享会", "activityType": "WEBINAR", "activityTypeLabel": "线上讲座", "signupCount": 86, "signupLimit": 200, "activityTimeStart": "2026-09-05 14:00", "activityTimeEnd": "2026-09-05 16:00", "activityTimeLabel": "2026-09-05 14:00 至 2026-09-05 16:00", "activityLocation": "线上直播间", "signupDeadline": "2026-09-05 12:00", "contactName": "林晓", "contactPhone": "13800001234", "creator": "平台运营", "status": "PUBLISHED", "statusLabel": "已发布", "coverImage": "growth-webinar.jpg", "createdAt": "2026-08-30 09:42" }, { "id": "ACT20260830012", "activityName": "夏末费率优惠活动", "activityType": "PROMOTION", "activityTypeLabel": "促销活动", "signupCount": 132, "signupLimit": 300, "activityTimeStart": "2026-09-01 00:00", "activityTimeEnd": "2026-09-15 23:59", "activityTimeLabel": "2026-09-01 00:00 至 2026-09-15 23:59", "activityLocation": "Yipex 活动中心", "signupDeadline": "2026-08-31 23:59", "contactName": "周宁", "contactPhone": "13900005678", "creator": "市场团队", "status": "PUBLISHED", "statusLabel": "已发布", "coverImage": "summer-rate.jpg", "createdAt": "2026-08-29 16:18" }, { "id": "ACT20260830007", "activityName": "商户运营训练营", "activityType": "OFFLINE", "activityTypeLabel": "线下活动", "signupCount": 24, "signupLimit": 60, "activityTimeStart": "2026-09-20 09:30", "activityTimeEnd": "2026-09-20 17:30", "activityTimeLabel": "2026-09-20 09:30 至 2026-09-20 17:30", "activityLocation": "上海市浦东新区会议中心", "signupDeadline": "2026-09-18 18:00", "contactName": "陈楠", "contactPhone": "13700007890", "creator": "客户成功部", "status": "DRAFT", "statusLabel": "草稿", "coverImage": "merchant-camp.jpg", "createdAt": "2026-08-29 11:06" }],
      "create": { "idPrefix": "ACT", "idField": "id", "timestampField": "createdAt", "defaults": { "status": "PUBLISHED", "statusLabel": "已发布", "creator": "平台运营", "signupCount": 0 } },
      "steps": [
        { "id": "basic", "title": "基本信息", "description": "填写活动基础资料", "fields": [{ "key": "activityName", "label": "活动名称", "required": true, "maxLength": 80, "placeholder": "请输入活动名称" }, { "key": "activityType", "label": "活动类型", "type": "select", "required": true, "labelKey": "activityTypeLabel", "placeholder": "请选择活动类型", "options": [{ "value": "PROMOTION", "label": "促销活动" }, { "value": "WEBINAR", "label": "线上讲座" }, { "value": "OFFLINE", "label": "线下活动" }] }, { "key": "coverImage", "label": "封面图片", "type": "upload", "required": true, "uploadLabel": "上传封面", "listType": "picture-card", "maxCount": 1, "help": "建议使用 16:9 JPG 或 PNG 图片" }, { "key": "activityTime", "label": "活动时间", "type": "date-time-range", "required": true, "startKey": "activityTimeStart", "endKey": "activityTimeEnd", "labelKey": "activityTimeLabel", "format": "YYYY-MM-DD HH:mm", "placeholder": ["开始时间", "结束时间"] }, { "key": "activityLocation", "label": "活动地点", "required": true, "maxLength": 120, "placeholder": "请输入活动地点" }] },
        { "id": "registration", "title": "报名设置", "description": "配置报名条件和联系信息", "fields": [{ "key": "signupLimit", "label": "报名人数上限", "type": "number", "required": true, "min": 1, "precision": 0, "placeholder": "请输入人数上限" }, { "key": "signupDeadline", "label": "报名截止时间", "type": "date-time", "required": true, "format": "YYYY-MM-DD HH:mm", "placeholder": "请选择截止时间" }, { "key": "contactName", "label": "联系人", "required": true, "maxLength": 30, "placeholder": "请输入联系人" }, { "key": "contactPhone", "label": "联系电话", "required": true, "pattern": "^1[3-9]\\d{9}$", "patternMessage": "请输入有效的手机号码", "placeholder": "请输入联系电话" }] },
        { "id": "confirm", "title": "发布确认", "description": "确认活动信息并发布", "fields": [] }
      ],
      "draftSubmission": { "actionLabel": "保存草稿", "loadingLabel": "保存中", "successMessage": "草稿已保存", "latencyMs": 320, "statusField": "status", "statusValue": "DRAFT", "statusLabelField": "statusLabel", "statusLabel": "草稿" },
      "previewAction": { "label": "预览" },
      "previewTitle": "活动预览",
      "confirmationTitle": "活动信息确认",
      "publishAction": { "label": "发布", "loadingLabel": "发布中", "statusField": "status", "statusValue": "PUBLISHED", "statusLabelField": "statusLabel", "statusLabel": "已发布" },
      "demoSubmission": { "mode": "success", "latencyMs": 500, "successMessage": "活动发布成功", "returnHref": "../activity-list/preview.html" }
    },
    "states": { "loading": false, "submitting": false, "error": false, "success": false, "permission-denied": false },
    "interactions": [{ "id": "nextActivityStep", "source": "next-activity-step", "event": "click", "outcome": "校验当前步骤后进入下一步" }, { "id": "previousActivityStep", "source": "previous-activity-step", "event": "click", "outcome": "返回上一步并保留输入" }, { "id": "cancelActivity", "source": "cancel-activity", "event": "click", "outcome": "取消并返回活动列表且不保存未提交修改" }, { "id": "saveActivityDraft", "source": "save-activity-draft", "event": "click", "outcome": "保存草稿并停留当前步骤" }, { "id": "previewActivityForm", "source": "preview-activity-form", "event": "click", "outcome": "打开完整活动预览" }, { "id": "publishActivity", "source": "publish-activity", "event": "click", "outcome": "校验全部必填项、发布活动并返回列表" }],
    "extensions": { "presentationDecisions": { "activity-steps": { "mode": "form-page", "confidence": "explicit", "evidence": ["用户明确要求基本信息、报名设置、发布确认三步"], "baseComponent": "Steps + Form + Descriptions confirmation", "requiresDeviation": false } }, "renderer": "yipex-standard-stepped-form-v1", "generation": { "strategy": "standard", "recipeId": "form.stepped-submit", "skeleton": "form-workflow", "capabilities": ["form.steps", "form.validation", "form.stickyActions", "form.review", "action.primary", "action.secondary", "binding.submissionToResult", "navigation.openPage"], "rendererId": "yipex-standard-stepped-form-v1" } }
  }
}
