{
  "schemaVersion": 2,
  "metadata": { "changeId": "20260830-user-management-edit", "pageName": "编辑用户", "pageType": "user-edit-form", "componentLibrary": { "name": "antd", "source": "official" }, "request": "编辑用户表单：修改用户名、手机号、角色、用户状态，保存成功后返回用户管理列表并刷新数据", "assumptions": ["未提供后端接口，保存使用浏览器内演示数据；通过 URL 的 id 参数定位用户。"], "ruleRefs": ["DESIGN.md", "01-foundations.md", "02-components.md", "05-form-patterns.md", "execution/presentation-intent.md", "execution/page-contract-v2.md", "execution/capability-model/capability-model.md"], "generation": { "mode": "auto", "strategy": "standard", "recipeId": "form.grouped-submit", "skeleton": "form-workflow", "capabilities": ["form.groups", "form.validation", "form.stickyActions", "action.primary", "action.secondary", "binding.submissionToResult"], "policyVersion": 1, "modelVersion": "2026.08.30.3", "rendererId": "yipex-standard-grouped-form-v1" } },
  "contract": { "pageFamily": "form", "shell": "yipex-default", "density": "standard", "regions": [{ "id": "user-form", "role": "form", "purpose": "编辑当前用户信息" }, { "id": "user-form-actions", "role": "action", "purpose": "取消或保存用户信息" }], "hierarchy": { "primary": "完成用户信息修改并保存", "secondary": ["核对用户权限和归属信息"] }, "operations": { "primary": { "id": "save-user", "label": "保存", "placement": "表单底部右侧", "outcome": "校验并保存用户修改，返回用户列表并刷新" }, "secondary": [{ "id": "cancel-user-edit", "label": "取消", "placement": "保存按钮左侧", "outcome": "放弃修改并返回用户列表" }] }, "stateCoverage": ["loading", "submitting", "error", "success", "permission-denied"], "responsive": { "desktop": "表单按主题分组并使用三列网格，底部操作区右对齐。", "narrow": "字段改为单列，底部操作区保持可见。" }, "deviations": [] },
  "page": {
    "shell": { "id": "yipex-default", "sidebar": { "width": 200, "background": "#F0F0F0", "showCollapseControl": true }, "brand": { "name": "Yipex", "logo": "logo.svg" }, "navigation": [{ "id": "home", "label": "首页", "icon": "HomeOutlined" }, { "id": "user-management", "label": "用户管理", "icon": "TeamOutlined", "active": true }], "header": { "welcome": "编辑用户", "userName": "平台运营", "email": "operations@yipex.tech", "avatar": "运" }, "footer": { "copyright": "Copyright Somei E-Commerce Limited 2025. All rights reserved" }, "floatingTools": { "show": false } },
    "root": { "id": "user-edit-page", "type": "standard-grouped-form-page", "props": { "title": "编辑用户", "primaryActionLabel": "保存", "secondaryActionLabel": "取消" }, "children": [{ "id": "user-form", "type": "form", "label": "用户信息", "children": [{ "id": "user-basic-section", "type": "form-section", "label": "基础信息" }, { "id": "user-access-section", "type": "form-section", "label": "权限信息" }] }, { "id": "user-form-actions", "type": "action", "children": [{ "id": "cancel-user-edit", "type": "button", "label": "取消", "events": { "click": "cancelUserEdit" } }, { "id": "save-user", "type": "button", "label": "保存", "events": { "click": "saveUser" } }] }] },
    "data": { "demo": true, "mode": "edit", "recordIdParam": "id", "persistenceKey": "yipex-user-management-demo", "entryHref": "../user-list/preview.html", "records": [{ "id": "U20260830001", "username": "林知夏", "phone": "138****2086", "role": "OPERATOR", "roleLabel": "运营人员", "status": "ACTIVE", "statusLabel": "正常", "registeredAt": "2026-08-30 09:42", "email": "lin.zhixia@example.com", "department": "运营中心" }, { "id": "U20260829012", "username": "周远", "phone": "186****4931", "role": "FINANCE", "roleLabel": "财务人员", "status": "ACTIVE", "statusLabel": "正常", "registeredAt": "2026-08-29 16:20", "email": "zhou.yuan@example.com", "department": "财务中心" }, { "id": "U20260828008", "username": "赵晴", "phone": "139****8165", "role": "AUDITOR", "roleLabel": "审计人员", "status": "INACTIVE", "statusLabel": "停用", "registeredAt": "2026-08-28 11:06", "email": "zhao.qing@example.com", "department": "风控中心" }, { "id": "U20260827017", "username": "吴川", "phone": "137****6250", "role": "OPERATOR", "roleLabel": "运营人员", "status": "CLOSED", "statusLabel": "锁定", "registeredAt": "2026-08-27 09:15", "email": "wu.chuan@example.com", "department": "运营中心" }, { "id": "U20260826005", "username": "沈念", "phone": "158****3077", "role": "ADMIN", "roleLabel": "管理员", "status": "ACTIVE", "statusLabel": "正常", "registeredAt": "2026-08-26 14:32", "email": "shen.nian@example.com", "department": "平台管理" }], "sections": [{ "id": "basic", "title": "基础信息", "fields": [{ "key": "username", "label": "用户名", "required": true, "placeholder": "请输入用户名", "maxLength": 32 }, { "key": "phone", "label": "手机号", "required": true, "placeholder": "请输入手机号", "maxLength": 11 }, { "key": "email", "label": "邮箱", "required": true, "placeholder": "请输入邮箱地址" }] }, { "id": "access", "title": "权限信息", "fields": [{ "key": "role", "label": "角色", "type": "select", "required": true, "labelKey": "roleLabel", "options": [{ "value": "ADMIN", "label": "管理员" }, { "value": "OPERATOR", "label": "运营人员" }, { "value": "FINANCE", "label": "财务人员" }, { "value": "AUDITOR", "label": "审计人员" }] }, { "key": "status", "label": "用户状态", "type": "select", "required": true, "labelKey": "statusLabel", "options": [{ "value": "ACTIVE", "label": "正常" }, { "value": "INACTIVE", "label": "停用" }, { "value": "CLOSED", "label": "锁定" }] }, { "key": "department", "label": "所属部门", "required": true, "placeholder": "请输入所属部门" }] }], "initialValues": {}, "create": { "idField": "id", "timestampField": "registeredAt" }, "demoSubmission": { "mode": "success", "latencyMs": 450, "successMessage": "用户修改成功", "returnHref": "../user-list/preview.html" } },
    "states": { "loading": false, "submitting": false, "error": false, "success": false, "permission-denied": false }, "interactions": [{ "id": "cancelUserEdit", "source": "cancel-user-edit", "event": "click", "outcome": "返回用户列表且不保存修改" }, { "id": "saveUser", "source": "save-user", "event": "click", "outcome": "校验并保存用户修改，返回列表" }], "extensions": { "presentationDecisions": {}, "renderer": "yipex-standard-grouped-form-v1", "generation": { "strategy": "standard", "recipeId": "form.grouped-submit", "skeleton": "form-workflow", "capabilities": ["form.groups", "form.validation", "form.stickyActions", "action.primary", "action.secondary", "binding.submissionToResult"], "rendererId": "yipex-standard-grouped-form-v1" } }
  }
}
